X,Y,OBJECTID,COMPANY_NAME,STREET_NUMBER,STREET_NAME,UNIT,POSTAL_CODE,BUSINESS_PARKBIA,IN_CIP,DOWNTOWN,DOWNTOWN_PLANNING_DISTRICT,SPACE_SIZE_SQFT,TOTAL_EMPLOYEES,PROFILE,PRIMARY_NAICS,PRIMARY_NAICS_SECTOR,PRIMARY_NAICS_DESCRIPTION,SECONDARY_NAICS,YEAR_ESTABLISHED_ORIGINALLY,EXPORTING,PHONE,TOLL_FREE,EMAIL,WEBSITE,FIRST_NAME_1,LAST_NAME_1,TITLE_1,FIRST_NAME_2,LAST_NAME_2,TITLE_2,ID,THE,NAME_SUFFIX,GlobalID
539303.812,4809288.47,1402,Bank of Nova Scotia,491,Highland Rd W,,N2M 5K2,None,Outside CIP,Not downtown,Not downtown,5000,28,Provide day-to-day and long-term financial and investment advice.,522112,52: Finance and insurance,Corporate and institutional banking industry,522111,1987,No,519-741-1021,,,www.scotiabank.com,Brad,Sarrows,Manager,Jennifer,Cockwell,Manager Customer Service,151,,,2a58033b-bc12-454d-9f49-d13e3ac2ddb2
541236.15375,4803462.241125,1403,Tepperman's Furniture,1415,Huron Rd,,N2R 0L3,N/A,N/A,N/A,N/A,70000,5,"retailer of home furnishings, appliances, electronics",TBD,To be determined,To be determined,,1925,,519-279-7810,,,http://www.teppermans.com/,Andrew,Tepperman,President,,,,2031,,,45c7fa06-a7c3-4fb8-a68e-7678e7d968a4
541137.94,4811018.47,1404,Total Convenience,140,King St W,,N2G 1A6,Downtown BIA,In CIP,Downtown,Centre,1.63,3,Convenience Store,445120,44-45: Retail trade,Convenience stores,,,,519-578-2060,,,,Sunghee,Yang,Store Owner,Mansik,Yang,,1693,,,0616d2b7-2240-49ef-961b-58a1bb6d98ce
541267.510625,4810759.385125,1405,Body and Soul,91,Queen St S,,N2G 1V9,Downtown BIA,In CIP,Downtown,Centre,747,1,SERVICES Health & Wellness,TBD,To be determined,To be determined,,,,519-741-8688,,,,Jindrick,Suehy,,,,,210,,,a2d2a2e9-30c5-4822-a7e8-7e16a04b13b9
541267.510625,4810759.385125,1406,Café Europe,91,Queen St S,1,N2G 4M7,Downtown BIA,In CIP,Downtown,Centre,,2,DINING Casual Dining,722,72: Accommodation and food services,Food services and drinking places,,,,519-579-7728,,,,Nikola,Sipovac,Owner,,,,253,,,9ebbbf2c-d096-4566-97e3-5e879034cde1
541267.510625,4810759.385125,1407,Gambero Bar & Lounge,91,Queen St S,,N2G 4M7,Downtown BIA,In CIP,Downtown,Centre,,4,DINING Casual Dining,722410,72: Accommodation and food services,Drinking places (alcoholic beverages),,,,519-404-9589,,,www3.serbiancafe.com/klijenti/gambero/,,,,,,,662,,,9d8da54c-4514-40ea-9468-e9a7a5c0169e
541267.510625,4810759.385125,1408,Games Exchange,91,Queen St S,,N2G 4M7,Downtown BIA,In CIP,Downtown,Centre,1000,3,"RETAIL Computers, Electronics",TBD,To be determined,To be determined,,,,519-745-3832,,,,Mike,Ciokan,Owner,,,,663,The,,44f8a843-d6ca-41af-a1e2-6e902a105253
541267.510625,4810759.385125,1409,Mary's Driving School,91,Queen St S,6,N2G 4M7,Downtown BIA,In CIP,Downtown,Centre,,1,,611690,61: Educational services,All other schools and instruction,,,,519-571-8124,,,,Mary,Maglacic,Owner,,,,1091,,,58514444-aec4-47db-a619-2ff3dca4f84c
541267.510625,4810759.385125,1410,Silver Star Social Club,91,Queen St S,,N2G 4M7,Downtown BIA,In CIP,Downtown,Centre,,2,,TBD,To be determined,To be determined,,,,,,,,,,,,,,1529,,,18afbb2f-70b6-4d3b-a1c8-5b64d85fe13b
541267.510625,4810759.385125,1411,Top Of The Line Clothing,91,Queen St S,,N2G 4M7,Downtown BIA,In CIP,Downtown,Centre,,1,"RETAIL Apparel, Accessories, Shoes",TBD,To be determined,To be determined,,,,519-342-0349,,,,,,,,,,1687,,,c49be81f-7def-48c0-92bd-f69c944128bb
543206,4812719,1412,Bodycote Thermal Processing Canada Inc.,9,Shirley Ave,,N2B 2E6,None,Outside CIP,Not downtown,Not downtown,25000,20,"Provide commercial heat treating of metal parts, machined, stamped, forged, pressed, cast or fabricated.",332810,31-33: Manufacturing,"Coating, engraving, cold and heat treating and allied activities",,1963,No,519-744-6301,,,www.bodycote.com,Gary,Prattis,General Manager,Tina,Robertson,Operations Support Manager,211,,,dd18f89f-d99b-4301-bf36-edf160da961d
547148.89,4803241.73,1413,Acme Telephone Company,74,Autumn Ridge Trail,,N2P 2M5,None,Outside CIP,Not downtown,Not downtown,3000,4,"Distribute Alcatel DSL/ADSL/modems and routers for business and residential solutions as well as telephone, voicemail, and network cabling for business.",417300,41: Wholesale trade,N/A,,1991,Yes,519-894-2121,1-866-623-2828,dave@acmetelephone.com,www.acmetelephone.com,David,Marsillo,President,,,,30,,,9f13a29d-d3c0-4f3d-9d53-4618fb960c6b
540049.058,4811444.735125,1414,Astral Funding Inc.,693,King St W,,N2G 1C9,None,Outside CIP,Not downtown,Not downtown,850,4,Provide mortgage brokerage services.,522310,52: Finance and insurance,Mortgage and non-mortgage loan brokers,,1984,No,519-744-6251,,,,Marion,Larsen,President,,,,115,,,5d4490ee-538b-4b2b-a6a3-73dcb64b0155
539716.647375,4809786.219875,1415,TD Canada Trust,272,Highland Rd W,,N2M 3C5,None,Outside CIP,Not downtown,Not downtown,,19,Provide personal and small business banking financial services.,522111,52: Finance and insurance,Personal and commercial banking industry,522112,1969,No,519-749-3277,,,,Brenda,Graham,Branch Manager,,,,1658,,,abc765f0-8090-4730-905d-be52f7752cde
538897.02,4807550.57,1416,Jones Scientific Products Inc.,67,Forestwood Dr,,N2N 1A9,None,Outside CIP,Not downtown,Not downtown,2000,2,"Distribute chemical spill control products, antiodorant products, pathology and biology products.",418410,41: Wholesale trade,Chemical (except agricultural) and allied product merchant wholesalers,,1987,No,519-745-5089,,jspinc@sgci.com,www.jonesscientific.com,Allan,Jones,President,,,,875,,,5fce8f5a-35f0-4dda-9f4a-e13167039563
542124.283125,4812165.86,1417,Dufferin Concrete,5,Johnston St,,N2G 4H9,None,Outside CIP,Not downtown,Not downtown,5000,46,Distribute ready mix concrete.,416310,41: Wholesale trade,General-line building supplies merchant wholesalers,,1875,No,519-749-6120,1-888-745-1151,dthomas@stlawrencecement.com,www.dufferinconcrete.ca,Deb,Thomas,Sales Coordinator,,,,525,,,833810ef-2a82-47a3-899b-182a4d1344d0
542570.0505,4810058.4145,1418,Phillips Bros. Rad & Air Conditioning,512,Charles St E,,N2G 2N1,None,Outside CIP,Not downtown,Not downtown,12000,20,Manufacture all types of radiators and heat exchangers.,332410,31-33: Manufacturing,Power boiler and heat exchanger manufacturing,,1974,No,519-744-6322,1-800-265-2289,phillips.bros@bellnet.ca,www.phillipsbros.aaro.ca ,Greg,Phillips,President,,,,1289,,,ce888e38-55e5-4cf2-ae7d-4a1bb88a5e87
544287.141125,4807348.3335,1419,Tri County Welding Supplies Limited,17,Manitou Dr,,N2C 1K9,None,Outside CIP,Not downtown,Not downtown,51000,45,Distribute wholesale welding supplies and gases.,417230,41: Wholesale trade,"Industrial machinery, equipment and supplies merchant wholesalers",418410,1967,Yes,519-894-1414,1-800-265-8277,email@tricoweld.com,www.tricoweld.com,Paul,Filiatrault,Chairman/CEO,Robert,Filiatrault,President/COO,1711,,,d49bab3d-50bf-404d-9e93-1edcc6653eac
542032.74875,4810448.145875,1420,M L Tax Service Inc.,539,King St E,,N2G 2L9,None,Outside CIP,Not downtown,Not downtown,1000,2,"Prepare business rental and personal tax returns, and provide instant cash for income tax refunds.",541213,"54: Professional, scientific and technical services",Tax preparation services,,1995,No,519-578-5781,,,,Sheila,Minh Le,Director,,,,1054,,,1b6969d2-f8aa-4ce9-aab5-db91a073a799
541268.142375,4811698.776625,1421,"Doerr Body & Trailer Co. Ltd., George C.",227,Breithaupt St,,N2H 5H3,None,Outside CIP,Not downtown,Not downtown,12000,19,"Distribute stake bodies, flat decks, hoists, tailgate loaders, hatchery vans for the transport industry.",415200,41: Wholesale trade,N/A,415190,1941,No,519-742-2100,,,,George,Doerr,President,,,,491,,,cb13cff5-0af2-4ea8-b9da-c513e9ed95bf
544571.111625,4809087.297375,1422,Peto MacCallum Ltd.,16,Franklin St S,,N2C 1R4,None,Outside CIP,Not downtown,Not downtown,10000,40,"Provide engineering services in the fields of geotechnical/geo-environmental construction, materials inspection and testing and building science services.",541330,"54: Professional, scientific and technical services",Engineering services,,1956,No,519-893-7500,,kitchener@petomaccallum.com,www.petomaccallum.com,John,Dietrich,President,Gerry,Mitchell,Branch Manager,1283,,,00ce8c4b-a270-4ec7-a715-a3257019e91f
541544.99275,4810832.152625,1423,"triOS College of Business, Technology, Healthcare",110,King St E,,N2G 0A5,Downtown BIA,In CIP,Downtown,Market,10800,22,"Provide diploma programs in medical, legal, office, IT and police fields.  Locations throughout Ontario.",611210,61: Educational services,Community colleges and C.E.G.E.P.s,,1992,No,519-578-0838,1-866-348-7467,kathy.edge@trios.com,www.trios.com,Arlene,Mahood,Director,,,,1724,,,0fc6c418-35de-4be3-9fb6-fb3ad42b929d
538270.236,4808593.228,1424,Cartridge Counter,875,Highland Rd W,,N2N 2Y2,None,Outside CIP,Not downtown,Not downtown,850,1,"Provide new and remanufactured compatible cartridges, printers and cellular accessories",,,,,,No,519-589-2225,,info@cartridgecounter.com,www.cartridge-counter.com,Antonio,Fiorillo,Manager,,,,1926,,,f4455761-afe4-42c8-95ce-a9917fc2335f
538270.236,4808593.228,1425,Island Inkjet,875,Highland Rd W,,N2N 2Y2,None,Outside CIP,Not downtown,Not downtown,800,4,Refill inkjet cartridges. Sell new and remanufactured toners and inkjet cartridges.,443120,44-45: Retail trade,N/A,,2000,No,519-584-2225,,,,Todd,Romhild,,,,,838,,,46a39190-ab16-4711-a206-d92df2611a0a
538270.236,4808593.228,1426,TD Canada Trust,875,Highland Rd W,,N2G 3W7,None,Outside CIP,Not downtown,Not downtown,2750,34,Provide personal and small business banking financial services.,522111,52: Finance and insurance,Personal and commercial banking industry,522112,1987,No,519-885-8549,,,www.tdcanadatrust.com,Dan,Menard,Branch Manager,Krissa,McIntosh,Manager of Financial Services,1656,,,a8b7a248-949f-40cb-9c59-5ae649fd59b6
541604.38875,4810865.590125,1427,Adana Fashion Footwear,25,Frederick St,238,N2H 6M8,Downtown BIA,In CIP,Downtown,Market,,1,Retail,448210,44-45: Retail trade,Shoe stores,,,,519-578-8160,,adanashoes@hotmail.com,,,,,,,,32,,,3d8eeaee-10d3-4f2e-ac4c-f19c7149e069
541604.38875,4810865.590125,1428,Athletic Direct,25,Frederick St,230,N2H 6M8,Downtown BIA,In CIP,Downtown,Market,2400,4,RETAIL Sports & Recreation,TBD,To be determined,To be determined,,,,519-571-1891,,strothjkl@sympatico.ca,,Nigel,Strothard,Owner,,,,117,,,4fc757f8-96ba-4981-80ae-a3cdc2ec8cc3
541604.38875,4810865.590125,1429,Kasual Korner,25,Frederick St,212,N2H 6M8,Downtown BIA,In CIP,Downtown,Market,1873,1,"RETAIL Apparel, Accessories, Shoes",TBD,To be determined,To be determined,,,,519-578-9941,,,,Paula,Karir,Owner,,,,887,,,d4d09578-5a5a-4aaa-b9fb-d77672932932
541604.38875,4810865.590125,1430,S & Y Gift & Smoke Shop,25,Frederick St,302,N2H 6M8,Downtown BIA,In CIP,Downtown,Market,580,1,RETAIL Specialty Shops,TBD,To be determined,To be determined,,,,519-742-0334,,edwardh51@hotmail.com,,Edward,Han,Owner,,,,1455,,,5ed9921b-fa14-47a8-86e4-5bfa8a2d1bb1
541604.38875,4810865.590125,1431,Star Nails,25,Frederick St,244,N2H 6M7,Downtown BIA,In CIP,Downtown,Market,350,1,Nail Salon,812110,81: Other services (except public administration),N/A,,,,519-745-6959,,,,Mai,Au,Owner,,,,1586,,,9e3c7308-a568-4dcb-8dfb-16a51a89e063
541604.38875,4810865.590125,1432,Ultimate Image Hair Salon,25,Frederick St,242,N2H 6M8,Downtown BIA,In CIP,Downtown,Market,645,2,Hair Styling,812110,81: Other services (except public administration),N/A,,,,519-743-4410,,,,David,Zoerner,Owner,,,,1753,,,c9b1d162-8f9d-46ee-b134-87f5f7cf5088
541604.38875,4810865.590125,1433,Z A Electronics,25,Frederick St,215,N2H 6M8,Downtown BIA,In CIP,Downtown,Market,600,1,"RETAIL Computers, Electronics",TBD,To be determined,To be determined,,,,519-741-4072,,,,Shekila,Nasreen,Owner,,,,1900,,,492c7b30-27c8-41fc-854b-8704039eecef
541604.38875,4810865.590125,1434,Watchman,25,Frederick St,232,N2H 6M8,Downtown BIA,In CIP,Downtown,Market,411,2,RETAIL Jewellers,TBD,To be determined,To be determined,,,,519-743-0985,,,,Peter,Nguyen,Owner,,,,1806,,,63cb9708-f737-4954-9bd6-9886c3433cc7
537072.296875,4808723.05925,1435,Impact Events Group Inc.,59,Heatherwood Pl,,N2N 3P4,None,Outside CIP,Not downtown,Not downtown,150,3,Provide event marketing and sponsorship services.,711320,"71: Arts, entertainment and recreation",N/A,,1999,No,519-579-3017,,guy@impacteventsgroup.ca,,Guy,Exley,President,,,,806,,,4d1b5321-6b5d-4cb5-9371-4598c01970f9
544379.47875,4807229.90925,1436,Damselfly Solutions Inc.,25,Manitou Dr,3AA,N2C 1K9,None,Outside CIP,Not downtown,Not downtown,850,3,"Analyze, develop and implement software solutions for critical business information. Specialize in web applications, website design, database development, windows applications, real time scheduling, on-line reporting and automated data collection.",541514,"54: Professional, scientific and technical services",Computer systems design and related services (except video game design and development),,2006,No,519-896-4007,,info@damselflysolutions.com,www.damselflysolutions.com ,Chris,Radder,President,,,,442,,,4d541f8a-ab1f-4394-a195-27c692dd74b2
544379.47875,4807229.90925,1437,Martron Inc.,500,Fairway Rd S,201,N2C 1X3,None,Outside CIP,Not downtown,Not downtown,2000,7,"Offer boutique marketing services specializing in developing best of breed sales, marketing strategy and tactics.",541610,"54: Professional, scientific and technical services",N/A,,1995,No,519-576-0895,1-888-447-7727,info@martron.com,www.martron.com,Martin,Fisher,President,,,,1090,,,7fa027b7-82ea-46c1-8c57-e633380d3581
544379.47875,4807229.90925,1438,NC Pestill Limited - Reprographics,29,Manitou Dr,1,N2C 1K9,None,Outside CIP,Not downtown,Not downtown,2000,7,Provide graphic design and digital printing services.,323115,31-33: Manufacturing,Digital printing,541430,1963,No,519-894-2160,1-877-737-8455,ncpk@ncpestill.com,www.ncpestill.com,Patrick,Skelton,Manager,,,,1193,,,778b14c8-3525-47f3-a48a-71b1935560cb
541259.14,4810053.7,1439,D.P. Haulage Ltd,101,Whitney Pl,,N2G 2X8,None,Outside CIP,Not downtown,Not downtown,,6,Provide general refuse pick-up services including waste container rentals. Also provide paper and cardboard recycling pick-up.,562110,"56: Administrative and support, waste management and remediation services",Waste collection,,1995,No,519-571-9884,,,,Dorel,Pekurar,President,,,,438,,,47b39061-4725-4819-a705-7d0784d3b174
541259.14,4810053.7,1440,Dorels Foods Ltd.,101,Whitney Pl,,N2G 2X8,None,Outside CIP,Not downtown,Not downtown,6000,6,"Distribute paper products, cheese, fresh vegetables, meat products, canned products and pizzeria supplies.",413110,41: Wholesale trade,General-line food merchant wholesalers,,1979,No,519-742-4670,,,,Paun,Pekurar,Owner,Sharon,Pekurar,Owner,495,,,c5a8f04c-3bfb-43c8-a2f3-ab26a5d56478
545216.004,4807260.299,1441,Marcon Custom Metals Inc.,698,Wilson Ave,,N2C 1H9,None,Outside CIP,Not downtown,Not downtown,70000,65,"Fabricate sheet, plate and structural hot rolled steel, stainless steel, aluminum. Provide metal processing, shearing, plate angle rolling, CNC punching, CNC plasma and flame cutting, and CAD drafting services.",332310,31-33: Manufacturing,N/A,332710,1963,Yes,519-893-6262,,sales@marconmetals.com,www.marconmetals.com,Randy,Gondosch,President,Bob,Parkyn,Manager,1078,,,38b74380-17fb-4621-9c54-3e5c52b02aac
541678.240625,4813108.64375,1442,Avrielle,335,Lancaster St W,,N2H 4V4,None,Outside CIP,Not downtown,Not downtown,,2,underwear and custom bra fitting and distribution,TBD,To be determined,To be determined,,2013,,226-339-0776,,info@avrielle.ca,http://avrielle.ca/ ,Connie,Boshart,Director of Operations,Alison,Wilson,Sales Director,2001,,,b325fa9b-89fd-4f2a-8116-855424daa02d
542299.26775,4809798.898375,1443,Borden Cold Storage Limited,150,Borden Ave S,,N2G 3R5,None,Outside CIP,Not downtown,Not downtown,145000,15,"Provide cold storage services for the food industry, meat tempering and co-packing with importing and exporting services available world-wide.",493120,48-49: Transportation and warehousing,Refrigerated warehousing and storage,,1999,Yes,519-585-2234,,borden@bordencoldstorage.com,www.bordencoldstorage.com,Doug,Cornwell,,Paul,Finnigan,,217,,,3f45723c-c259-4755-9bd8-62fa71f79365
544040.636875,4813121.710625,1444,Stotesbury Transfer Limited,300,Shirley Ave,,N2B 2E1,None,Outside CIP,Not downtown,Not downtown,,40,"Provide transportation services for bulk milk, kosher vegetable oils, liquid food and sweetener.",484221,48-49: Transportation and warehousing,"Bulk liquids trucking, local",484222,1950,Yes,519-745-7032,,info@stotesburytransfer.com,www.stotesburytransfer.com,Bryan,Stotesbury,President,Bruce,Stotesbury,Secretary Treasurer,1601,,,bac6043f-22b1-4fc3-b98e-b99289fb982a
543425.068625,4812781.385,1445,Morval Division of Woodbridge Foam Corporated,68,Shirley Ave,,N2G 4E1,None,Outside CIP,Not downtown,Not downtown,90000,100,"Manufacture bead foam plastics for use in protective packaging, material handling and OEM components. Industries served include automotive, pharmaceutical, consumer electronics, and sports and leisure.",326140,31-33: Manufacturing,Polystyrene foam product manufacturing,326193,1951,Yes,519-579-6100,1-888-466-7825,,www.woodbridgegroup.com,Brian,Blamire,Sales/Product Engineer,John,Zianis,Plant Manager,1170,,,4764cd41-7e5a-4fa0-9236-aaef0c3e85f9
541427.20825,4812325.564125,1446,Inspirations Dancewear & Costumes Ltd.,180,St Leger St,,N2H 4M5,None,Outside CIP,Not downtown,Not downtown,,19,"RETAIL Apparel, Accessories, Shoes",TBD,To be determined,To be determined,,,,519-743-6699,,service@inspirationsdancewear.com,www.inspirationsdancewear.com,Sharyn ,Riedel,Owner,Amber,Riedel,Owner,823,,,0dfd432f-9418-4537-9d34-d29c98a7a39b
539963.2245,4811036.807875,1447,Masonry by Rasmussen,214,Park St,,N2G 1M9,None,Outside CIP,Not downtown,Not downtown,100,2,"Provide masonry services specializing in the sale and service of chimneys, fireplaces, chimney cleaning, insurance inspections, removal of animals and installation of chimney caps and chimney liners.",238140,23: Construction,Masonry contractors,561791,1984,No,519-571-0888,,,communities.msn.com/ChimneysEtc,Henry,Rasmussen,Proprietor,,,,1092,,,efb98f0e-c56a-4188-874b-f094e0535ef8
540726.350625,4812449.40325,1448,Morguard Residential,315,Margaret Ave,110,N2H 6S5,None,Outside CIP,Not downtown,Not downtown,,8,"Provide real estate services including acquisition, development and management of properties.",531310,53: Real estate and rental and leasing,Real estate property managers,,1967,No,,,,,Donald,Cameron,Senior Property Manager,Pat,Golden,Resident Manager,1165,,,c02d8e80-efbd-4d13-ac25-38987249c7da
543250.67075,4812442.860125,1449,Kober Enterprise Corporation,871,Victoria St N,2,N2B 3S4,None,Outside CIP,Not downtown,Not downtown,1501,6,"Distribute and service computer systems, hardware and software. Service contracts for small and large companies. Offer consulting services.",541514,"54: Professional, scientific and technical services",Computer systems design and related services (except video game design and development),,1992,No,519-741-5418,1-800-871-8170,sales@kober.net,www.kober.net,Andrew,Tadros,President,Shpesime,Ismailoski,Controller/Manager,946,,,730ba80d-e7ad-47a6-8cf8-230fa61d1b86
543250.67075,4812442.860125,1450,Vine and Partners LLP,871,Victoria St N,217,N2B 3S4,None,Outside CIP,Not downtown,Not downtown,525,2,Provide accounting services.,541212,"54: Professional, scientific and technical services",Offices of  accountants,,1972,No,519-578-0430,,larrym@vine.on.ca,www.vine.on.ca,Larry,Matlow,Partner,,,,1779,,,2a21af11-c50e-4b39-abcf-cf888dfb8303
542324.16,4813539.56,1451,Assante Financial Management,487,Riverbend Dr,2,N2K 3S3,Lancaster Corporate Centre,Outside CIP,Not downtown,Not downtown,8800,21,"Provide personalized, integrated wealth management solutions to achieve personal goals. Work to ensure all financial affairs are addressed through investments, insurance, taxation, and estate planning.",523920,52: Finance and insurance,Portfolio management,,1996,No,519-578-4494,,,www.assante.com,Janice,Nixon,Branch Manager,,,,112,,,ac2ad73b-310d-4dab-ab77-89ff9432d97f
541710.824875,4811774.014125,1452,Stride Print  - The Letter Service Inc.,309,Victoria St N,,N2H 5E1,None,Outside CIP,Not downtown,Not downtown,4000,7,"Provide printing, copying (black and white, and colour), design and mailing services. Additional services include laminating, faxing, folding, plak-it mounting, and letterpress (numbering and perforating).",323114,31-33: Manufacturing,Quick printing,561490,1927,No,519-744-6541,,info@strideprint.com,www.strideprint.com,Richard,Peers,Manager,,,,1606,,,05b096c7-5b7e-43c5-85c7-69fc85541fd9
541555.15275,4810826.860875,1453,Grand Magazine,160,King St E,400,N2G 4L3,Downtown BIA,In CIP,Downtown,Market,,1,SERVICES Media & Communications,TBD,To be determined,To be determined,,,,519-895-5214,,lhaddrall@grandmagazine.ca,www.grandmagazine.ca,Lynn,Haddrall,Editor-in-Chief,,,,701,,,7bbb02e7-9744-4131-a869-94ac934c9b91
541555.15275,4810826.860875,1454,Nordia Inc.,160,King St E,400,N2G 4L3,Downtown BIA,In CIP,Downtown,Market,38000,250,Provide quality multi-contact customer relationship management solutions to business partners.,561420,"56: Administrative and support, waste management and remediation services",Telephone call centres,,1999,No,519-579-8906,,hrkit@nordia.ca,www.nordia.ca,Sheri,Markle,Director,,,,1213,,,e30335f5-92e1-47b7-8eba-49db566abdd8
541555.15275,4810826.860875,1455,REX Magazine,160,King St E,400,N2G 4L3,Downtown BIA,In CIP,Downtown,Market,,1,SERVICES Media & Communications,TBD,To be determined,To be determined,,,,519-895-5215,,,www.rexmagazine.ca,Lynn,Haddrall,Editor-in-chief,,,,1414,,,e568c20a-878e-42da-84e2-8d4a4f5dbaaf
541555.15275,4810826.860875,1456,Record,160,King St E,,N2G 4E5,Downtown BIA,In CIP,Downtown,Market,52000,144,Publish local newspaper.,511110,51: Information and cultural industries,Newspaper publishers,,1878,No,519-894-2231,,,www.therecord.com,Dana,Robbins,Publisher,Lynn,Haddrall,Editor-in-Chief,1814,The,,10179270-a9ac-4bd7-b5aa-4ef648adc16b
543040.300125,4812069.082875,1457,ACI Survey Consultants Inc.,582,Frederick St,,N2B 2A9,None,Outside CIP,Not downtown,Not downtown,2500,14,"Provide legal survey services in the land surveying industry for residential and commercial customers. Offer GIS, leasable area and optical tooling.",541360,"54: Professional, scientific and technical services",Geophysical surveying and mapping services,541370,2003,No,519-578-2220,,gary.auer@landsurveyor.ca,www.landsurveyor.ca,Gary,Auer,President,Larry,Hrivnak,Director,28,,,35e7e841-2a29-4b39-84ea-1d0497ca2967
539400.49775,4811776.655375,1458,Moore McDermott & Partners LLP,928,King St W,,N2G 1G4,None,Outside CIP,Not downtown,Not downtown,3000,10,"Provide public accounting, auditing and taxation services.",541212,"54: Professional, scientific and technical services",Offices of  accountants,541213,1975,No,519-579-0700,,robertm@mmandp.com,www.mmandp.com,Robert,McDermott,Partner,,,,1161,,,c0a0d456-993c-4547-bb08-ab5da43fd4a1
540762.410125,4812505.48325,1459,MacMillan & Associates Ltd.,305,Margaret Ave,1103,N2H 6S4,None,Outside CIP,Not downtown,Not downtown,500,1,"Provide commercial photography, association management and conference planning services.",541920,"54: Professional, scientific and technical services",Photographic services,561920,1977,No,519-504-1579,,,,David A.,MacMillan,President,,,,1064,,,1b272527-89f2-4162-aacd-c475423b8962
542580.03,4814305.52,1460,Poly Disposables (2004) Ltd.,30,Grand Ave,,N2K 1B3,None,Outside CIP,Not downtown,Not downtown,6000,3,Manufacture and distribute polyethylene products.,326100,31-33: Manufacturing,N/A,,2004,Yes,519-576-0530,1-877-281-1676,,,Sonja,Lagueux,President,,,,1313,,,63087cb8-2a34-48e8-ba5d-08be608d2cab
543227.519625,4812384.982375,1461,"Staebler Company Limited, H.L.",871,Victoria St N,,N2B 3S4,None,Outside CIP,Not downtown,Not downtown,21000,65,"Provide personal, commercial and life insurance products, and access to risk management and loss control services.",524210,52: Finance and insurance,Insurance agencies and brokerages,,1873,No,519-743-5221,1-800-321-9187,info@staebler.com,www.staebler.com,Kim,Philpott,President,Linda,Edisbury,VP Operations & H.R.,1579,,,84d37367-222c-444f-ac65-7bc68051d964
542677.9,4805319.8,1462,Smith Energy Inc.,565,Trillium Dr,7,N2R 1J4,Huron Business Park,Outside CIP,Not downtown,Not downtown,2600,8,Distribute process and heating boilers and indirect water heaters.,416120,41: Wholesale trade,"Plumbing, heating and air-conditioning equipment and supplies merchant wholesalers",,1988,No,519-744-7295,,maureen@smithenergy.com,,William J.,Smith,President,David,Smith,VP,1541,,,dd653dd9-ab18-4dea-8ba7-dbeb051ff82a
539724.055625,4809779.02325,1463,H & B Security Services Limited,274,Highland Rd W,,N2M 3C5,None,Outside CIP,Not downtown,Not downtown,2500,17,"Sell and install commercial and residential alarm systems, intercoms and locks.",561621,"56: Administrative and support, waste management and remediation services",Security systems services (except locksmiths),561622,1980,No,519-578-6268,,service@hbsecurity.com,www.hbsecurity.com,Heinz,Fischer,Treasurer/Secretary,Robert,Olsen,President,730,,,f4b52ffb-e68d-4894-8f68-e08a0bd4280e
541748.127125,4810764.961375,1464,Ely Matlow Real Estate,28,Eby St N,,N2H 2V5,Downtown BIA,In CIP,Downtown,Market,7000,2,Provide real estate services.,531211,53: Real estate and rental and leasing,Real estate agents,,,No,519-578-8100,,,www.ematlowrealestate.com,Ely,Matlow,Owner,,,,562,,,4babc2a7-c238-4122-836e-6780cfb25224
544501.6,4806223.202,1465,Liftsafe Engineering and Service Group Inc.,154,Otonabee Dr,,N2C 1L6,None,Outside CIP,Not downtown,Not downtown,10000,50,Sell and service lifting equipment. Provide safety inspection services.  Provide structural engineering services.,541330,"54: Professional, scientific and technical services",Engineering services,541350,1990,Yes,519-896-2430,1-800-977-2005,info@liftsafeinspections.com,www.liftsafeinspections.com,Dirk,Kerbs,President,Rob,Barrett,Director of Engineering,1023,,,dc704148-9f67-4eeb-8373-803b86d9d42a
