X,Y,OBJECTID,COMPANY_NAME,STREET_NUMBER,STREET_NAME,UNIT,POSTAL_CODE,BUSINESS_PARKBIA,IN_CIP,DOWNTOWN,DOWNTOWN_PLANNING_DISTRICT,SPACE_SIZE_SQFT,TOTAL_EMPLOYEES,PROFILE,PRIMARY_NAICS,PRIMARY_NAICS_SECTOR,PRIMARY_NAICS_DESCRIPTION,SECONDARY_NAICS,YEAR_ESTABLISHED_ORIGINALLY,EXPORTING,PHONE,TOLL_FREE,EMAIL,WEBSITE,FIRST_NAME_1,LAST_NAME_1,TITLE_1,FIRST_NAME_2,LAST_NAME_2,TITLE_2,ID,THE,NAME_SUFFIX,GlobalID
545757.37475,4808587.377,447,Guest Inn Motel,2933,King St E,,N2A 1A8,None,Outside CIP,Not downtown,Not downtown,,4,Provide lodging accommodation.,721114,72: Accommodation and food services,Motels,,1980,No,519-893-7011,,,,Sam,Patel,,Lili,Patel,,727,,,78ab48e4-8f05-4b41-8b57-19c66d09e77a
544682.955875,4805422.249875,448,Canada Alloy Castings,529,Manitou Dr,,N2C 1S2,None,Outside CIP,Not downtown,Not downtown,83000,85,"Manufacture carbon steel, low alloy steel and high alloy steel castings to 22,000 lbs.",331110,31-33: Manufacturing,Iron and steel mills and ferro-alloy manufacturing,,1956,Yes,519-895-1161,,tbutcher@cac.ca,www.cac.ca,Tim,Butcher,General Manager,Shirley,Jackman,Customer Service,257,,a div of Flowserve Canada Corp.,8ed0f289-eec8-438d-a52f-cec7631342c1
542686.577,4811923.737,449,Cunningham Lindsey Canada Ltd.,460,Frederick St,202,N2H 2P5,None,Outside CIP,Not downtown,Not downtown,3000,9,Provide insurance claim adjusting services. Provide insurance services for the remediation of environmental hazards.,524291,52: Finance and insurance,Claims adjusters,,1928,No,519-578-5020,,,www.cunninghamlindsey.com,Andrew,Walls,Branch Manager,Deb,Labreche,Senior Adjuster,426,,,01b6be9b-5679-4d0c-ac60-b919acc946f0
542686.577,4811923.737,450,Norris Bakery Ltd.,460,Frederick St,,N2H 2P5,None,Outside CIP,Not downtown,Not downtown,4200,30,Produce baked goods.,311814,31-33: Manufacturing,Commercial bakeries and frozen bakery product manufacturing,311811,1943,No,519-742-0564,,,,Robert,Harsch,Owner,,,,1215,,,475f1971-66b0-4d81-996d-351ae98252cc
542000.573875,4814766.83825,451,M C Designs,46,Hillcrest Lane,,N2K 1S8,None,Outside CIP,Not downtown,Not downtown,1200,1,Provide graphic design services.,541430,"54: Professional, scientific and technical services",Graphic design services,,1982,No,519-744-8379,,mquak1107@rogers.com,,Meriam (Mary),Quak,Owner,,,,1053,,,f65da13e-7c6b-46fe-b279-1b989f5c92a5
541356.35,4810856.38,452,20/20 Vision Clinic,19,King St E,,N2G 2K4,Downtown BIA,In CIP,Downtown,Centre,1500,3,SERVICES Health & Wellness. Eye exams and retail sales,TBD,To be determined,To be determined,,,,519-749-2020,,vajihr@yahoo.ca,www.2020visionclinic.ca ,Vajih,Rajabi,Manager,,,,4,,,cead1b95-0f9b-455b-8143-55e45b88561d
541009.44,4813908.15,453,Hometex Flag & Banners Corporation,11,Springdale Dr,,N2K 1P8,None,Outside CIP,Not downtown,Not downtown,2000,7,Manufacture and sell flags and flag hardware.  Custom quilting work for bedspreads and upholstery.,313210,31-33: Manufacturing,Broad-woven fabric mills,314990,1967,Yes,519-576-9807,1-888-513-8885,info@hometex.com,www.hometex.com,Peter,Kautsky,General Manager,Ilsedore,Kautsky,Assistant,777,,,3bf3b0e9-0061-4874-aa39-f370da296d94
541232.36,4810779.14,454,Far Out Flicks,94,Queen St S,,N2G 1V9,Downtown BIA,In CIP,Downtown,Centre,700,2,"RETAIL Books, Music & Video",TBD,To be determined,To be determined,,,,519-743-7102,,faroutflicks@hotmail.com,www.faroutflicks.com,Rolf,Glemser,President,,,,606,,,a100e0b7-d5d5-453a-87fa-d20852029d2e
544596.604,4806187.804,455,Satellite Communication Source,277,Manitou Dr,E,N2C 1L4,None,Outside CIP,Not downtown,Not downtown,2500,5,Sell and rent satellite communication equipment.,517111,51: Information and cultural industries,Wired telecommunications carriers (except cable),,1986,Yes,519-884-3838,1-800-461-3255,infops@satellitecomsource.com,www.satellitecomsource.com,Alan,Skinner,Manager,,,,1468,,,a451993f-17d2-411a-a16a-74623d011b30
542820,4809947,456,Canada Brokerlink,1145,King St E,201,N2G 2N3,None,Outside CIP,Not downtown,Not downtown,2442,11,Provide general insurance services.,524210,52: Finance and insurance,Insurance agencies and brokerages,,1971,No,519-576-5242,1-800-711-5330,,,Angela,Hussett,Manager,,,,259,,,bd9353bc-307b-48af-b255-08d7c046b1b9
540933.586,4811262.936,457,Candu Electric,52,Water St N,,N2H 5A8,Downtown BIA,In CIP,Downtown,Centre,,1,Provide electrical services including installation and maintenance to residential and commercial markets.,238210,23: Construction,Electrical contractors and other wiring installation contractors,,1994,No,519-571-7042,,,,Harold J.,Pizzey,,,,,277,,,4d436506-b293-410e-90de-4134d4b10e21
540933.586,4811262.936,458,Miss Chin Hair & Nails,52,Water St N,,,Downtown BIA,In CIP,Downtown,Centre,,1,Hair Styling,812115,81: Other services (except public administration),Beauty salons,,,,,,,,,,,,,,1148,,,2eb86cdb-1c3a-490e-8910-ed34b2868990
540933.586,4811262.936,459,Spectrum Hair Studio,52,Water St N,,N2H 5A8,Downtown BIA,In CIP,Downtown,Centre,,5,,812110,81: Other services (except public administration),N/A,,,,519-741-5619,,,,Rosa,Goodine,Owner,,,,1553,,,3f805acf-e576-4677-b9e2-578aeff77ae6
541371.5,4811205.97,460,"Babcock, Derek",28,Weber St W,,N2H 3Z2,None,Outside CIP,Not downtown,Not downtown,,3,Provide legal services.,541110,"54: Professional, scientific and technical services",Offices of lawyers,,1982,No,519-742-3570,,,,Derek,Babcock,Owner,,,,133,,,47cc7dd0-5d35-47ea-b91a-8d67d2485cc8
541371.5,4811205.97,461,Mortgage Intelligence,28,Weber St W,,N2H 3Z2,None,Outside CIP,Not downtown,Not downtown,1500,4,Specialize in commercial and residential mortgages and business financing.,522310,52: Finance and insurance,Mortgage and non-mortgage loan brokers,523910,,No,519-571-6464,,dale.bilton@migroup.ca,www.mortgageintelligence.ca,Dale,Bilton,Mortgage Consultant,Tracy,Bennett,Mortgage Consultant,1169,,,170a984d-5f2f-45e0-baef-2a82707dc47a
547585.373,4803618.998,462,Investment Planning Counsel of Canada,100,Conestoga College Blvd,1100,N2P 2N6,None,Outside CIP,Not downtown,Not downtown,5500,8,"Provide financial services including financial planning, investments, and insurance.",523920,52: Finance and insurance,Portfolio management,523930,1994,No,519-578-2591,1-800-513-8374,fdakos@ipckitchener.com,www.moneytipswithfrank.com,Frank,Dakos,Manager,Laura,King,Office Manager,834,,,1e8e9b04-f3db-4846-8b0d-bea2f853c4b1
541296.793,4811100.90225,463,Dr. Jeff Diefenbacher,104,Ontario St N,,N2H 4Y6,Downtown BIA,In CIP,Downtown,Centre,700,5,Health & Wellbeing,621210,62: Health care and social assistance,Offices of dentists,,,,519-743-3671,,jdief@golden.net,,Jeff,Diefenbacher,Owner,,,,511,,,4d3df823-1cfc-4441-8bb4-8f1ca3168f20
543721.978625,4807485.4875,464,KCM Waterjet,90,Balzer Rd,,N2C 1X6,None,Outside CIP,Not downtown,Not downtown,,1,Provide production waterjet job shop services.  Profile cut any known material.,238990,23: Construction,All other specialty trade contractors,332710,,No,519-895-2204,,kcmsteel@gto.net,www.kcmwaterjet.ca,,,,,,,892,,,c1b8ba6c-87b7-4782-8d5d-e44175f09184
541249.9,4811069.91,465,Jack Burger Pub,45,Duke St W,,N2H 3W6,Downtown BIA,In CIP,Downtown,Centre,,3,DINING Casual Dining,722,72: Accommodation and food services,Food services and drinking places,,,,519-570-0321,,,,Darryl,Moore,,,,,847,,,021aa41e-7afd-46d4-a529-73859e36464d
546557.6975,4810974.59675,466,Mister Nevada (Kitchener/Waterloo) Ltd.,74,Wendy Cres,,N2A 3T2,None,Outside CIP,Not downtown,Not downtown,926,2,"Provide fundraising consulting services offering Nevada tickets, bingo supplies, and general fundraising products.",561490,"56: Administrative and support, waste management and remediation services",Other business support services,,1990,No,519-742-9500,,,,Ron,Shepard,President,Jo-Ann,Shepard,Secretary Treasurer,1149,,,db361fa3-d121-472f-b2c3-d35453243354
543493.182625,4810100.72825,467,Printessential Limited,32,Brentwood Ave,,N2H 2C5,None,Outside CIP,Not downtown,Not downtown,,3,Specialize in print and promotional products.,541899,"54: Professional, scientific and technical services",All other services related to advertising,323110,1996,No,519-743-6472,1-888-624-6668,promo@printessential.on.ca,www.printessential.ca,Robert,Zilles,President,,,,1330,,,42b8cfd5-5fdc-4d75-9789-b3ad40de8672
546758.62775,4808274.709875,468,Barlows Associates Rehabilitation Services Inc.,1601,River Rd E,307,N2A 3Y4,None,Outside CIP,Not downtown,Not downtown,525,3,"Provide personal and career counselling through EAP, self and professional referral. Provide disability case management, rehabilitation and vocational rehabilitation counselling.",541612,"54: Professional, scientific and technical services",Human resources consulting services,,1990,No,519-894-8975,,barlowassociates@execulink.com,,Michael,Barlow,Secretary,Theresa,Barlow,President,154,,,6cc89b8e-1fa5-4c8c-9510-5e2cf8d5470d
546758.62775,4808274.709875,469,Gary H. Attack Financial Planning Inc.,1601,River Rd E,203,N2A 3Y4,None,Outside CIP,Not downtown,Not downtown,2000,4,"Provide investment planning, retirement planning, tax planning and estate planning services.",523930,52: Finance and insurance,Investment advice,523920,1983,No,519-894-2661,,gary@ghafinancial.com,www.ghafinancial.com,Gary H.,Attack,President,,,,664,,,e60cbc1d-15f2-4c4a-bdd8-7d155db91e54
546758.62775,4808274.709875,470,Kitchener Executive Consultants,1601,River Rd E,201,N2A 3Y4,None,Outside CIP,Not downtown,Not downtown,1600,8,"Provide personnel recruitment search services for operation and plant management, production management, finance, human resources, engineering and marketing.",561310,"56: Administrative and support, waste management and remediation services",Employment placement agencies and executive search services,,1976,No,519-894-3030,,kec@golden.net,www.kitchenerexecutive.com,Jim,Fairfax,President,Joan,Fairfax,Vice President,920,,,44b2204b-1f92-453a-bab5-3a6f94be16a2
546758.62775,4808274.709875,471,MNE Engineering Incorporated,1601,River Rd E,309,N2A 3Y4,None,Outside CIP,Not downtown,Not downtown,,10,"Provide mechanical and electrical design services for the construction industry including plumbing, HVAC, lighting and power plans.",541330,"54: Professional, scientific and technical services",Engineering services,541490,1993,No,519-894-9408,,email@mneeng.on.ca,,Paul,Gubbels,Electrical Engineer,,,,1153,,,50a714e4-1eeb-43e5-ad0f-11b9a11b1050
546758.62775,4808274.709875,472,Lovett's Rod and Gun Center Limited,3310,King St E,,N2A 1B3,None,Outside CIP,Not downtown,Not downtown,1000,1,Sell retail hunting equipment such as firearms and ammunition.,451110,44-45: Retail trade,N/A,,1954,No,519-893-4867,,,,Keith,Lovett,CEO,,,,1043,,,0fb923d6-6602-483e-abd8-bf1066ecbba8
546758.62775,4808274.709875,473,Porcelain Magic Inc.,3310,King St E,B,N2A 1B3,None,Outside CIP,Not downtown,Not downtown,1500,4,"Reglaze, refinish and repair porcelain, acrylic and fibreglass products including bathtubs, tiles, sinks, showers, as well as regrouting and tub liner removal.",811411,81: Other services (except public administration),Home and garden equipment repair and maintenance,,1988,No,519-748-4040,1-800-461-8827,,,Tomislav,Drlje,Manager - Operations,Steve,Campbell,"Owner, President",1316,,,21ba0615-2b4b-456b-8820-9f1e4efe72a9
542472.46,4805469.77,474,Augsburg Fortress Canada,500,Trillium Dr,19,N2G 4Y4,Huron Business Park,Outside CIP,Not downtown,Not downtown,15000,19,Manufacture and distribute church supplies.,339990,31-33: Manufacturing,All other miscellaneous manufacturing,418990,1950,Yes,519-748-2200,,,www.afcanada.com,Andrew,Seal,Canadian Director,John,Carr,Finance Manager,119,,,f1165e50-b183-4cd6-b8ed-ed0b41d5bf0d
542472.46,4805469.77,475,Core Tool Technologies,565,Trillium Dr,2A,N2R 1J4,Huron Business Park,Outside CIP,Not downtown,Not downtown,1200,4,"Distribute agent for air/DC, training facility, torque controlled assembly tools, and related tool service, parts and accessories.",417230,41: Wholesale trade,"Industrial machinery, equipment and supplies merchant wholesalers",,1994,Yes,519-748-9092,,,www.coretooltech.com,Kevin,Martin,President,,,,393,,,09d97540-b9a6-46cb-a182-5ff74d1f0731
542472.46,4805469.77,476,Gentek Building Products,500,Trillium Dr,29,N2R 1E5,Huron Business Park,Outside CIP,Not downtown,Not downtown,24700,9,"Distribute aluminum and vinyl building products, windows, sidings, doors and related products from the Kitchener branch.",416310,41: Wholesale trade,General-line building supplies merchant wholesalers,416340,1954,No,519-748-2475,1-800-265-8245,,www.gentek.ca,Hogie,Umlandt,Branch Manager,Jamie,Steinberg,Sales,671,,,8f197ac7-fb35-473c-a29a-a9a73df563bb
542472.46,4805469.77,477,Vanfax,35,McBrine Pl,1,N2R 1G4,Huron Business Park,Outside CIP,Not downtown,Not downtown,10000,6,Distribute wholesale automotive glass.,415290,41: Wholesale trade,Other new motor vehicle parts and accessories merchant wholesalers,,1990,No,519-748-9727,1-800-668-0933,,,Robert,Wagner,Manager,,,,1768,,,3aeeb0e2-d070-4114-8ae7-f598f94a90d7
540925.94,4811067.31,478,271 West,271,King St W,,N2G 1B1,Downtown BIA,In CIP,Downtown,Centre,1200,9,Casual Dining - sitdown,722511,72: Accommodation and food services,Full-service restaurants,,,,519-954-8821,,zloncar21@rogers.com,www.271west.com ,Zeljko,Loncar,,,,,5,,,ea077048-9574-447f-b483-31a1f74d1d81
543349.679625,4809781.0975,479,Faucheux & Associates,18,Jackson Ave,,N2H 3N8,None,Outside CIP,Not downtown,Not downtown,,2,Provide bookkeeping and accounting services.,541215,"54: Professional, scientific and technical services","Bookkeeping, payroll and related services",,2001,No,519-841-6477,,coralie_faucheux@yahoo.ca,,Coralie,Faucheux,President,,,,611,,,f715d30e-aa83-4184-9ac9-ee6639db78fd
542694.61925,4811322.033,480,"Bebenek Carpentry Ltd., Mike",32,Sheridan Crt,,N2H 2Z2,None,Outside CIP,Not downtown,Not downtown,100,2,"Provide contracting services including renovations for kitchens, bathrooms, cabinetry and window replacements.",238350,23: Construction,Finish carpentry contractors,236110,1989,No,519-745-1390,,,,Mike,Bebenek,President,Lynn,Bebenek,Secretary Treasurer,163,,,20fc5f6f-18ad-46c2-94c8-0e01259824ac
543521.327125,4805754.857625,481,Wayco Multi-Lift Inc.,30,Adam Ferrie Pl,,N2E 2A9,Huron Business Park,Outside CIP,Not downtown,Not downtown,12000,30,"Rent and service forklift trucks and equipment for material handling needs. Sell parts for trucks. Sales of new and used lift trucks, and ergonomic equipment.",532400,53: Real estate and rental and leasing,N/A,811310,1982,Yes,519-748-5440,1-800-430-8654,,www.wayco.ca,Trevor,Strassburger,,Brian,Wood,General Manager,1823,,,aaf65962-8f2d-4239-aebe-2606e440a2e2
540224,4811575,482,Stanson Electric Inc.,57,Moore Ave,,N2H 3S2,None,Outside CIP,Not downtown,Not downtown,6000,6,"Offer complete commercial, industrial and residential electrical services.",238210,23: Construction,Electrical contractors and other wiring installation contractors,,1983,No,519-747-2406,,,www.stansonelectric.com,Matt,Stanson,President,,,,1582,,,70bd2ab0-21b9-4207-81c8-2cd2dc30a080
541293.094125,4810007.71675,483,Jukes Sign Studios Ltd.,111,Whitney Pl,,N2G 2X8,None,Outside CIP,Not downtown,Not downtown,6000,4,"Manufacture and install wooden signs, truck lettering, illuminated signs and sandblasted signs. Provide large format digital printing services. Provide service for electric signs, crane bucket service, vehicle paint chip touch up service.  Sign design.",339950,31-33: Manufacturing,Sign manufacturing,323115,1940,No,519-743-2659,,info@signsbyjukes.com,www.signsbyjukes.com,Lee,Jukes,President,,,,880,,,6ce01117-24e8-4e2f-b2ba-44cc751b9f56
545607.502,4811932.6265,484,Jim Schuett,107,Oakhurst Cres,,N2B 3K2,None,Outside CIP,Not downtown,Not downtown,,1,Install and service propane and natural gas equipment.,238220,23: Construction,"Plumbing, heating and air-conditioning contractors",,2007,No,519-498-1456,,jimschuett@rogers.com,,Jim,Schuett,Owner,Jane,Schuett,,865,,,26e50e79-ba79-43c5-b20d-7b185f3476fb
544301.021,4809152.130875,485,Lino Santarossa Plastering,25,Fourth Ave,,N2C 1N9,None,Outside CIP,Not downtown,Not downtown,,4,"Provide custom plastering, moulding, stucco and ceramic tiling services including renovations and repairs.",238310,23: Construction,Drywall and insulation contractors,238340,,No,519-896-0412,,,,Lino,Santarossa,Owner,Angela,Santarossa,Owner,1026,,,99b01587-bdb5-4e28-99c9-1fa176598cfc
541390.27,4811838.7,486,ABC's Party Time Rentals,262,Breithaupt St,,N2H 5H5,None,Outside CIP,Not downtown,Not downtown,5000,9,"Rent special event equipment such as tents, tables, chairs, dishware and funfair items.",532290,53: Real estate and rental and leasing,Other consumer goods rental,,1979,No,519-745-8274,1-888-226-6601,partyrental@yahoo.ca,www.abcpartytime.com,Roy,Evans,President,Ken,Evans,Vice President,17,,,f4e185a6-506b-489c-9fb3-49383454f225
542243.71,4805874.56,487,Showcase Interiors Inc.,63,McIntyre Pl,9,N2R 1J5,Huron Business Park,Outside CIP,Not downtown,Not downtown,7000,5,"Manufacture high-end cabinetry, and distribute hardware and polyurethane mouldings.",337110,31-33: Manufacturing,Wood kitchen cabinet and counter top manufacturing,416330,1993,Yes,519-896-8004,1-800-265-6722,,www.showcaseinteriors.ca,Steve,Nechacov,President,Mike,Nechacov,Vice- President,1519,,,6b1c40c5-f53e-4cc6-b2e0-8b21928008e2
541278.969625,4810889.213,488,A Second Look Books & Videos,31,King St W,,N2G 1A1,Downtown BIA,In CIP,Downtown,Centre,,3,"RETAIL Books, Music & Video",453310,44-45: Retail trade,Used merchandise stores,,,,519-744-2274,,info@asecondlookbooks.com,www.asecondlookbooks.com,Rosemary,Tait,Owner,John,Poag,Owner,12,,,26aaf730-142f-4caf-84bc-caf9845d8529
537307.92,4807398.92,489,Milmine Designs,471,Driftwood Dr,,N2N 1Y9,None,Outside CIP,Not downtown,Not downtown,,2,"Provide graphic design and art including logo designs illustration, ad design, brochures sign design, stationery design and folders.",541430,"54: Professional, scientific and technical services",Graphic design services,,1977,No,519-744-4726,,ron@milminedesigns.com,www.milminedesigns.com,Ron,Milmine,Owner,Uta,Milmine,Co-owner,1140,,,3b75fe0b-ff32-4a76-ac30-2d2aec7d3268
541625.63,4810804.7,490,Angel's Cradle,19,Scott St,,N2H 2P6,Downtown BIA,In CIP,Downtown,Market,,1,SERVICES Health & Wellness,TBD,To be determined,To be determined,,,,519-744-1919,,bgdiamonds-gold@sympatico.ca,www.theangelscradle.com,Pamela,Maguire,Owner,,,,90,,,55ff97b7-39f9-4735-9d90-f13380fefbf2
541625.63,4810804.7,491,JBM Products.com - Internet Café,19,Scott St,C,,Downtown BIA,In CIP,Downtown,Market,,1,SERVICES Consultants & IT,TBD,To be determined,To be determined,,,,519-745-7802,,jmeludie@hotmail.com,,Jean-Baptiste,Meludie,Manager,,,,857,,,7e62e3c0-a134-458c-a94f-8a31d4410c52
541625.63,4810804.7,492,John's Bikes,19,Scott St,B,,Downtown BIA,In CIP,Downtown,Market,,1,RETAIL Sports & Recreation,TBD,To be determined,To be determined,,,,519-804-5869,,,,,,,,,,873,,,c4295860-2c4b-4151-b018-895fdd3d8432
541625.63,4810804.7,493,Two Steps Custom Leather & Crafts,19,Scott St,,,Downtown BIA,In CIP,Downtown,Market,,2,RETAIL Specialty Shops,TBD,To be determined,To be determined,,,,519-807-8404,,,,,,,,,,1749,,,9cb51c71-18eb-4aeb-9706-55e0a692a018
542820,4809947,494,Winters Technical Staffing Services,1145,King St E,3,N2G 2N3,None,Outside CIP,Not downtown,Not downtown,1300,4,Provide technical and professional placement services.,561310,"56: Administrative and support, waste management and remediation services",Employment placement agencies and executive search services,541612,1971,No,519-578-1755,1-866-793-0592,kelly@winterstaffing.com,www.winterstaffing.com,Kelly,Schlosser,Branch Manager,,,,1854,,,dfecd705-a82e-424c-9abd-f683ab755eef
541105.64775,4810983.0745,495,Pho DNK,151,King St W,,N2G 1A7,Downtown BIA,In CIP,Downtown,Centre,,2,DINING Vietnamese,722,72: Accommodation and food services,Food services and drinking places,,,,519-579-5226,,,,Thanh,Chau,Owner,,,,1292,,,d46cb87a-3955-488a-9963-ac44b6091bfd
540184.308,4810677.433,496,Team Realty K.W. Inc.,186,Victoria St S,,N2G 2B9,None,Outside CIP,Not downtown,Not downtown,1700,3,Provide real estate services including appraisals.,531212,53: Real estate and rental and leasing,Offices of real estate brokers,531320,1987,No,519-741-1400,1-800-275-8849,info@teamrealtykw.com,www.teamrealtykw.com,Ian,Brown,President,John,Ordiway,Vice President,1662,,,df272eeb-da3a-4215-a185-52dad07b9146
547637.222,4803062.366,497,Grandview Homes,24,Executive Pl,,N2P 2N4,None,Outside CIP,Not downtown,Not downtown,8000,10,Develop new homes.,236110,23: Construction,Residential building construction,,1988,No,519-748-2800,,gvh@email.com,www.grandview-homes.com,Garo,Bostajian,President,,,,708,,,14451a47-c41f-4b9c-8b37-9c760d665801
539922.525375,4809628.388125,498,Inspire Health and Wellness,107,Belmont Ave W,107,N2M 5E2,None,Outside CIP,Not downtown,Not downtown,,1,"Provide massage therapy and chiropractic services for a number of health concerns including injury, chronic postural complaints, relaxation, neck and back pain and headaches",TBD,To be determined,To be determined,,2013,No,519-745-1331,,reception@inspirehealthandwellness.ca,www.inspirehealthandwellness.ca,Shannon,Viana,Owner,,,,824,,,a0b5da2b-040c-4fd1-bfe6-ff5d1b64501c
542583.11525,4809712.378125,499,Advantedge Mailing Solutions,109,Ottawa St S,,N2G 3S8,None,Outside CIP,Not downtown,Not downtown,,10,"Offer full service letter-shop capabilities including a complete range of mail preparation, sortation, and data services.",561910,"56: Administrative and support, waste management and remediation services",Packaging and labelling services,561430,2000,No,519-742-6700,,quotes@mailingadvantedge.com,www.mailingadvantedge.com,Geoff,Sheridan,President,,,,41,,,48b30e6d-e820-4755-b0c6-1b65d8d0c2ae
541362.499,4803775.637,500,Corian Tile,155,Sophia Cres,,N2R 1X7,None,Outside CIP,Not downtown,Not downtown,,1,Install tiles.,238340,23: Construction,Tile and terrazzo contractors,,,No,519-748-2781,,,,Daniel,Mesesan,Owner,,,,395,,,7fec7215-13d3-40f6-80c7-74eaf619425e
549558,4805911,501,Embassy Motel,4521,King St E,,N2P 2G2,None,Outside CIP,Not downtown,Not downtown,,3,Provide motel accommodation.,721114,72: Accommodation and food services,Motels,,1978,No,519-653-3176,,,,Vasu,Patel,Manager,,,,563,,,2436be2f-95fb-40aa-83cf-098cf29802d5
542465.60125,4805358.1225,502,Certified Testing Systems,622,Trillium Dr,,N2L 3H5,Huron Business Park,Outside CIP,Not downtown,Not downtown,8000,25,Provide ISO 17025 accredited laboratory services in non-destructive testing. In-house laboratory or mobile units for field/shop inspection.,541380,"54: Professional, scientific and technical services",Testing laboratories,541690,1983,No,519-748-2880,,cts01@sentex.net,www.certified-testing.com,Daniel,Bogatin,Director & General Manager,,,,311,,,31a4fe14-5ace-41bc-9d58-811668b7aa27
542465.60125,4805358.1225,503,CTS Technologies Inc.,622,Trillium Dr,,N2R 1E6,Huron Business Park,Outside CIP,Not downtown,Not downtown,8000,10,"Provide certification on new and used aerial devices, including acoustic emission, mechanical/operational, structural inspection (non-destruction testing), and stability testing. In-house and mobile units available.",541380,"54: Professional, scientific and technical services",Testing laboratories,541690,1983,Yes,519-748-2880,,cts04@sentex.net,www.certified-testing.com,Chad,Rayner,Technician,Daniel,Bogatin,General Manager,422,,,50265ec0-1f4a-4f24-89a5-101a1c46095f
543738.538125,4805200.0,504,Thermopatch (Canada) Inc.,25,Groff Pl,5,N2E 2L6,Huron Business Park,Outside CIP,Not downtown,Not downtown,2000,5,"Provide laundry identification, garment tracking, decorating and mending systems, and related supplies to the laundry, textile and garment manufacturing industries.",333310,31-33: Manufacturing,Commercial and service industry machinery manufacturing,,1968,No,519-748-5027,1-800-265-6416,thermopatch@bellnet.ca,www.thermopatch.com,Ben,Schemool,General Manager,Barbara,Roussel,Operations Manager,1672,,,8a4b5f75-81e5-4ebf-9c5c-8b577c8dd15b
542418.301625,4805727.4505,505,Thinkage Ltd.,85,McIntyre Dr,B,N2R 1H6,Huron Business Park,Outside CIP,Not downtown,Not downtown,5000,11,Manufacture custom computer software.  Make MainBoss maintenance software.,511210,51: Information and cultural industries,N/A,541510,1991,Yes,519-895-1860,1-800-563-8094,info@thinkage.ca,www.thinkage.ca,Patrick,Maloney,VP Sales & Marketing,Anita,Kilgour,Marketing,1674,,,5cf2ac43-0931-4c55-995f-eb3b67043fbf
541407.96,4811111.62,506,Business Development Bank of Canada,50,Queen St N,110,N2H 6P4,Downtown BIA,In CIP,Downtown,Centre,5243,12,Provide financial banking services including commercial lending and consulting services.,522111,52: Finance and insurance,Personal and commercial banking industry,522112,1944,No,519-571-6884,1-800-265-2489,,www.bdc.ca,Steven,Soper,Branch Manager,Judy,Reynolds,Partner,246,,,4e69e587-8ce1-49e7-b4ae-56ee1787c7ee
541407.96,4811111.62,507,"Department of Foreign Affairs, Trade and Development",50,Queen St N,110,N2H 6P4,Downtown BIA,In CIP,Downtown,Centre,,1,SERVICES Organizations,911410,91: Public administration,Foreign affairs,,,,519-571-6656,,robin.macnab@international.gc.ca,www.tradecommissionar.gc.ca,Robin,MacNab,Trade Commissioner,,,,470,,,b34dcd70-20d3-404a-b894-8f0fcf838e70
541407.96,4811111.62,508,Gowling Lafleur Henderson LLP,50,Queen St N,1020,N2H 6M2,Downtown BIA,In CIP,Downtown,Centre,42460,112,"Provide a full range of legal services including corporate, commercial, technology law, intellectual property, securities, litigation, employment law, real estate, immigration, and family law.",541110,"54: Professional, scientific and technical services",Offices of lawyers,,1902,No,519-576-6910,,info@gowlings.com,www.gowlings.com,John,Doherty,Managing Partner,Manuel,Martins,Partner,700,,,0e88817e-6105-41e7-8ed0-1200a2b06bad
