X,Y,OBJECTID,COMPANY_NAME,STREET_NUMBER,STREET_NAME,UNIT,POSTAL_CODE,BUSINESS_PARKBIA,IN_CIP,DOWNTOWN,DOWNTOWN_PLANNING_DISTRICT,SPACE_SIZE_SQFT,TOTAL_EMPLOYEES,PROFILE,PRIMARY_NAICS,PRIMARY_NAICS_SECTOR,PRIMARY_NAICS_DESCRIPTION,SECONDARY_NAICS,YEAR_ESTABLISHED_ORIGINALLY,EXPORTING,PHONE,TOLL_FREE,EMAIL,WEBSITE,FIRST_NAME_1,LAST_NAME_1,TITLE_1,FIRST_NAME_2,LAST_NAME_2,TITLE_2,ID,THE,NAME_SUFFIX,GlobalID
546633.028,4808178.431,890,M.J. May Design Inc.,3267,King St E,205,N2H 4A4,None,Outside CIP,Not downtown,Not downtown,250,1,Provide residential project design and management services.,541490,"54: Professional, scientific and technical services",Other specialized design services,541340,1995,No,519-742-6628,,,,Mark,May,President,,,,1059,,,49db18d5-b6ec-4e0b-bb57-64230e6deb71
541242.418,4810708.14875,891,Lutheran Bible Translators Of Canada Inc,137,Queen St S,,N2G 1W2,None,In CIP,Downtown,Centre,1700,3,SERVICES Churches & Temples,TBD,To be determined,To be determined,,,,519-742-3361,,info@lbtc.ca,www.lbtc.ca,David,Maffett,Executive Director,,,,1049,,,ef2b1d4f-e008-423b-b04c-6915ce75a2c9
541242.418,4810708.14875,892,St. Paul's Lutheran Church,137,Queen St S,,N2G 1W2,None,In CIP,Downtown,Centre,25000,6,,813110,81: Other services (except public administration),Religious organizations,,,,519-745-4891,,hstpauls@golden.net,www.historicstpauls.ca,Rick,Frey,Vacancy Pastor,,,,1577,,,3c0e28ca-1ac5-48cc-a76f-610f95b5ee70
543422,4814319,893,B & K Wood Specialties Ltd.,75,Hollinger Cres,,N2K 2Y8,Bridgeport Business Park,Outside CIP,Not downtown,Not downtown,6500,5,"Manufacture kitchen cupboards, bathroom vanities and furniture. Provide commercial mill work services.",337100,31-33: Manufacturing,N/A,321910,1982,Yes,519-742-6361,,bkwoodltd@aol.com,www.onbitz.com/bandk,George,Belsky,President,,,,131,,,1405f445-fa6f-4fb2-939e-1ef362b7c5ce
540551.33,4811056.834125,894,Cher's Hair & Skin,151,Charles St W,R11,,Downtown BIA,In CIP,Downtown,Innovation,,4,Hair Styling,812115,81: Other services (except public administration),Beauty salons,,,,519-569-8355,,,www.climageconsulting.com,,,,,,,316,,,a57f9bcf-6e32-45d3-851a-7a87e69e7696
540815.776875,4811430.518125,895,A Body In Motion Rehabilitation,70,Victoria St N,E,N2H 5C2,Downtown BIA,In CIP,Downtown,Innovation,1400,10,Health & Wellbeing,621340,62: Health care and social assistance,"Offices of physical, occupational, and speech therapists and audiologists",,,,519-579-3746,,abodyinmotion@on.aibn.com,www.abodyinmotion.ca,Keri ,Martin Vrbanac,Clinic Owner/Physiotherapist,,,,11,,,663ce630-ea27-4cfb-89e1-cf82f604c49a
543702.94175,4811948.219875,896,Dunbar Electric Inc.,14,Camden Pl,,N2B 1P8,None,Outside CIP,Not downtown,Not downtown,1800,2,Provide electrical contracting services.,238210,23: Construction,Electrical contractors and other wiring installation contractors,,1972,No,519-743-8995,,mdunbar@golden.net,www.dunbarelectric.ca,Mark,Dunbar,President,,,,527,,,4f752f4b-299c-4984-b5fc-31a9e7c0ce76
542595.433,4805148.7725,897,PWO Canada Inc.,255,McBrine Dr,,N2R 1G7,Huron Business Park,Outside CIP,Not downtown,Not downtown,150000,270,"Manufacture tools, dies, metal stampings, and deep draws and metal components and systems for automotive application in electric and electronic safety like airbag and seat structures and structures for chassis and suspension.",332110,31-33: Manufacturing,N/A,332210,1919,Yes,519-893-6880,,,www.progress-werk.de,Karl,Schreyer,President,Steve,Witt,Mngr Sales & Project Mngm't,1350,,,4571ebdb-72bc-4a54-ab9e-290ec7b3bf2f
542280.0545,4810364.7055,898,Stephen Cox Contracting,11,Fairview Ave,,N2H 3E7,None,Outside CIP,Not downtown,Not downtown,,1,"Perform general contracting, custom woodworking, millworking and cabinetry.",236110,23: Construction,Residential building construction,337123,1982,No,519-742-4992,,stephen_cox@rogers.com,,Stephen,Cox,Owner,,,,1592,,,defa0a20-a927-4b6f-9208-a012b30184bc
541797.89,4813428.01,899,"Reinhart Glass Service Inc., Joe",465,Maple Ave,5,N2H 6N5,None,Outside CIP,Not downtown,Not downtown,2400,5,"Install glass, metal and plastic frames for residential and commercial clients.",238150,23: Construction,Glass and glazing contractors,238350,1994,No,519-578-4041,,,,Joe,Reinhart,Owner,,,,1400,,,214c3ef6-1d8e-4813-84f2-535b9f319493
539505.755375,4809426.614625,900,Royal Bank of Canada,413,Highland Rd W,,N2M 3C6,None,Outside CIP,Not downtown,Not downtown,3500,20,Provide financial banking services.,522111,52: Finance and insurance,Personal and commercial banking industry,522112,1919,No,519-575-2280,1-800-769-2511,,,Diane,Mathiew,Branch Manager,,,,1444,,,b2b7a962-fa7a-4174-970f-4d6f10446595
541845.490625,4809911.809125,901,"Howald Pools Inc., Terry",274,Courtland Ave E,,N2G 2V7,None,Outside CIP,Not downtown,Not downtown,10000,20,Sell and install swimming pools and spas.,236200,23: Construction,N/A,453999,1972,No,519-578-1634,,,,Terry,Howald,Owner,,,,786,,,8bd13fef-605c-47ae-b716-ed283c2acf0f
547088.265875,4806813.348875,902,Progressive Engineering Services Ltd.,2043,Hidden Valley Cres,,N2C 2R2,None,Outside CIP,Not downtown,Not downtown,,1,"Provide engineering consulting services to businesses, developers and government agencies.",541330,"54: Professional, scientific and technical services",Engineering services,,1986,No,519-748-0101,,,,Guenter K.,Nuessler,President,,,,1337,,,de11fcc8-3fc8-40ab-9584-c75cb7a07a95
542090.3265,4810406.658,903,Lohmer Real Estate & Appraisals Ltd.,587,King St E,,N2G 2M2,None,Outside CIP,Not downtown,Not downtown,2000,4,Provide residential appraisals and real estate services.,531212,53: Real estate and rental and leasing,Offices of real estate brokers,531320,1982,No,519-743-0000,,lohmer@golden.net,,Shirley,Lohmer,President,,,,1036,,,5ee4e71f-265d-4d5b-a84f-3a9065123457
543424.979625,4805662.918625,904,K-W Materials Handling Inc.,300,Trillium Dr,11,N2E 2K6,Huron Business Park,Outside CIP,Not downtown,Not downtown,2000,5,"Provide materials handling, distribution, warehouse equipment and storage solution services including shipping safety supplies, dock equipment, maintenance and installation service. Offer over 250,000 items.",493110,48-49: Transportation and warehousing,General warehousing and storage,418990,1991,Yes,519-748-1345,1-888-894-2555,kwmaterial1@bellnet.ca,www.ontarioindustrial.com,Frank,McGuire,President,Todd,McGuire,Manager,970,,,400baa30-fa26-47c5-b1c2-b04afdd05e7f
535963,4807473,905,Control Technologies Inc.,15,Cora Dr,,N2N 3C6,None,Outside CIP,Not downtown,Not downtown,400,2,Provide industrial controls and automation services.,417230,41: Wholesale trade,"Industrial machinery, equipment and supplies merchant wholesalers",,1995,No,519-579-5366,,general@controltechnologies.ca,,Kevin,Ambrose,President,Dianne,Ambrose,Office Manager,389,,,06ca9ed2-4226-41f3-b617-2aa952626789
544201.0,4807370.964375,906,Panagos & Van Flooring Ltd.,5,Manitou Dr,103,N2C 2J6,None,Outside CIP,Not downtown,Not downtown,6500,10,"Sell and install carpet, vinyl, ceramic tiles, cork, hardwood, laminate, marble and granite for residential and commercial markets. Supply and install floors for insurance restoration companies.",442210,44-45: Retail trade,Floor covering stores,,1998,No,519-894-8767,,panagos-van@on.aibn.com,,Peter,Panagos,President,Quang,Van,Vice President,1254,,,1ed20e22-ab26-40fc-82d1-dba5c25849d3
545530.4365,4813470.176625,907,Ticket Defenders Inc.,1561,Victoria St N,,N2B 3E4,None,Outside CIP,Not downtown,Not downtown,1500,5,Provide paralegal advice services for driving offence tickets.,541190,"54: Professional, scientific and technical services",Other legal services,,1989,No,519-744-4384,,info@ticketdefence.ca,www.ticketdefence.ca,Ron,Harper,Owner,Dana,Smith,Owner,1678,,,efe8a6cb-f1e9-4cb0-8793-9037c8d69fcb
543755.388125,4805281.510125,908,Angstrom Engineering,91,Trillium Dr,,N2E 1W8,Huron Business Park,Outside CIP,Not downtown,Not downtown,15000,35,Design and manufacture vacuum test chambers for thin film deposition technology research.,334512,31-33: Manufacturing,"Measuring, medical and controlling devices manufacturing",,1992,Yes,519-894-4441,,sales@angstromengineering.com,www.angstromengineering.com,David,Pitts,President,,,,91,,,695579b7-759e-46fc-9445-133fd4b6e25c
541239.888125,4810909.44925,909,Afex,55,King St W,,N2G 4W1,Downtown BIA,In CIP,Downtown,Centre,,6,Foreign currency provider - non bank,,,,,,,,,,,Mike,Elliott,"Regional Director, SW Ontario",,,,1965,,,08ddbd0b-efdd-4fed-8b49-2da8ffc8494d
541239.888125,4810909.44925,910,Blackwell Bowick Partnership Ltd.,55,King St W,,N2G 4W1,Downtown BIA,In CIP,Downtown,Centre,120,2,SERVICES Architects & Planners,TBD,To be determined,To be determined,,,,519-616-0895,,info@blackwellbowick.com,www.blackwellbowick.com,David,Bowick,Principle,,,,198,,,6ed51172-17da-40e6-809b-a1044371f2be
541239.888125,4810909.44925,911,Clevernet Solutions Inc.,55,King St W,,N2G 4W1,Downtown BIA,In CIP,Downtown,Centre,,1,SERVICES Business Products & Services,TBD,To be determined,To be determined,,,,519-772-7772,,,www.clevernetsolutions.com,Chuck,,President,,,,341,,,f2a90556-6426-4934-a3fd-3a7fbea86065
541239.888125,4810909.44925,912,Golden Bean,55,King St W,,N2G 4G1,Downtown BIA,In CIP,Downtown,Centre,200,2,DINING Cafes and Bakeries,722,72: Accommodation and food services,Food services and drinking places,,,,519-585-2195,,c.usher@sympatico.ca,,Christine,Usher,Owner,,,,689,The,,076f8cdc-bd71-472a-9a44-7eb88e029fcf
541239.888125,4810909.44925,913,IGLOO Inc.,55,King St W,,N2G 4W1,Downtown BIA,In CIP,Downtown,Centre,17000,125,Provide secure corporate social networking suites to organizations of any size. Offer collaboration and knowledge sharing between distributed teams and the mobile workforce. Uses a software-as-a-service delivery model for cost-effective social networks.,541514,"54: Professional, scientific and technical services",Computer systems design and related services (except video game design and development),,2008,Yes,519-489-4120,1-877-664-4566,info@igloosoftware.com,www.igloosoftware.com,David,Vanheukelom,"VP, Product Strategy",Peter,Smith,"EVP, Field Operations",804,,,02101c5e-18a0-495c-9c76-b32c3c911836
541239.888125,4810909.44925,914,Madorin Snyder LLP,55,King St W,,N2G 4G9,Downtown BIA,In CIP,Downtown,Centre,12635,44,"Provide civil litigation, corporate, family and real estate legal services including wills and estates.",541110,"54: Professional, scientific and technical services",Offices of lawyers,,1954,No,519-744-4491,,info@kw-law.com,www.kw-law.com,W.H. Peter,Madorin Q C,Managing Partner,Jane,Kay,Administration Manager,1067,,,d87ce349-c7a4-4a4f-9abd-0d71ecd6c5d8
541239.888125,4810909.44925,915,Penad Pension Services Limited,55,King St W,,N2G 4W1,Downtown BIA,In CIP,Downtown,Centre,5500,20,"Provide third party pension administration services including pension administration software, benefit consulting and actuarial services.",526110,52: Finance and insurance,N/A,,1983,Yes,519-743-9000,1-800-563-1978,info@penad.ca,www.penad.com,Frank,Price,Chairman and CEO,Matthew,Price,Global Business Development,1275,,,9563812d-0f8f-4cd5-9427-71a7044d24f0
541239.888125,4810909.44925,916,Regus Business Centre,55,King St W,,N2G 4W1,Downtown BIA,In CIP,Downtown,Centre,10000,3,"Provide office space, meeting rooms and video conferencing.",531120,53: Real estate and rental and leasing,Lessors of non-residential buildings (except mini-warehouses),,1990,No,519-772-7500,,charlotte.beddow@regus.com,www.regus.com,Charlotte,Beddow,General Manager,,,,1399,,,6aafba90-fcdc-46f3-941d-832052516716
541239.888125,4810909.44925,917,Ricoh Canada Inc.,55,King St W,,N2G 4W1,Downtown BIA,In CIP,Downtown,Centre,,18,SERVICES Business Products & Services,TBD,To be determined,To be determined,,,,519-743-5601,,,www.ricoh.ca,Ken,Arp,Branch Manager,,,,1417,,,8fe2d925-23f8-44ce-a525-e43dcd082617
541239.888125,4810909.44925,918,Simple Financial,55,King St W,,N2G 4W1,Downtown BIA,In CIP,Downtown,Centre,,1,SERVICES Financial Services,TBD,To be determined,To be determined,,,,,,,,,,,,,,1532,,,e0c536c3-8233-4b6f-bd5b-f8aa0bfeb152
541239.888125,4810909.44925,919,Track-It,55,King St W,,N2G 4W1,Downtown BIA,In CIP,Downtown,Centre,,2,SERVICES Consultants & IT,TBD,To be determined,To be determined,,,,519-501-2412,,,www.track-itcanada.com,Kevin,Mikolash,Inventory Specialist,,,,1696,,,31bfd339-63ff-451b-9b35-10acb50f8963
541239.888125,4810909.44925,920,Workplace Safety and Insurance Board,55,King St W,,N2G 4W1,Downtown BIA,In CIP,Downtown,Centre,,150,Promote workplace health and safety and provide workers compensation system for the employees and employers of Ontario.,541690,"54: Professional, scientific and technical services",Other scientific and technical consulting services,524129,1918,No,519-576-4130,1-800-265-2570,,www.wsib.on.ca,Pat,Pringle,"Director, Service Delivery",,,,1873,,,612713fa-cc8a-4661-a1e4-0042f2909f48
536546.04225,4807479.661125,921,Darren Ouellette,171,Rolling Meadows Dr,,N2N 2H1,None,Outside CIP,Not downtown,Not downtown,1100,5,"Supply and install signage. Including awnings, banners, sign cabinets, illuminated letters, digital printing electronic displays, fleet and vehicle graphics, 3 dimensional logos and letters. Sign repair and service, surveys and permits.",238990,23: Construction,All other specialty trade contractors,417920,2004,No,519-580-7549,,canadasign@rogers.com,www.canadasign.ca,Darren,Ouellette,President,,,,449,,,97a742cf-fd4c-4653-a4b6-87cd2f08ce28
544853.082875,4807179.488,922,Vitran Express Canada Inc.,85,Webster Rd,,N2C 2E7,None,Outside CIP,Not downtown,Not downtown,10000,50,Provide international and domestic LTL transportation services.,484120,48-49: Transportation and warehousing,N/A,484110,1991,No,519-748-9124,1-800-265-8213,,www.vitran.com,Glen,Webster,Branch Manager,Terry,King,Operations Manager,1783,,,580f1609-fba4-4c0c-92b3-2cd24453e163
541746.14,4810851.24,923,K-W Korean Presbyterian Church,130,Duke St E,,N2H 1A7,Downtown BIA,In CIP,Downtown,Market,500,1,,813110,81: Other services (except public administration),Religious organizations,,,,519-742-2929,,revjongpark@hotmail.com,,Jong ,Min Park,Pastor,,,,967,,,665f6532-7016-49d8-a11f-a596c16a41d2
540735.037,4811562.643,924,Athena Software,318,Duke St W,,N2H 3Y1,None,Outside CIP,Not downtown,Not downtown,1500,10,Provide web based integrated case management software that delivers efficiency and greater effectiveness to an organization in social services.,541514,"54: Professional, scientific and technical services",Computer systems design and related services (except video game design and development),,2001,Yes,,1-866-806-6014,info@athenasoftware.net,www.athenasoftware.net,Dana,Fox,Director Business Development,,,,116,,,bf13db13-68c9-441f-8e38-c90c22a214d3
544866.04375,4813432.181375,925,MHBC Planning,540,Bingemans Centre Dr,200,N2B 3X9,Grand River West Business Park,Outside CIP,Not downtown,Not downtown,10000,28,"Provide planning services to all government levels and the private sector in Ontario, specializing in cities and towns. Provide urban design, aggregate resource planning, resource management, landscape architecture and cultural heritage services.",541320,"54: Professional, scientific and technical services",Landscape architectural services,,1973,No,519-576-3650,,klovett@mhbcplan.com,www.mhbcplan.com,Ian,MacNaughton,President,Bernie,Hermsen,Partner,1130,,,7e748855-1ba8-4f7a-ae36-f47f87d8cfe5
540815.776875,4811430.518125,926,Cake Box,70,Victoria St N,F,,Downtown BIA,In CIP,Downtown,Innovation,5600,6,DINING Cafes and Bakeries,311811,31-33: Manufacturing,Retail bakeries,,,,519-579-6230,,yvonne@cakebox.ca,www.cakebox.ca,Yvonne,Zensner,,,,,255,The,,d127ca3a-23a5-4bdf-8a98-a86eca9ba9e5
543437.6135,4805796.77625,927,Mike's Diesel Fuel Injection,50,Adam Ferrie Pl,,N2E 2A9,Huron Business Park,Outside CIP,Not downtown,Not downtown,8000,4,"Sell and service diesel fuel injection, turbochargers and engine parts. Provide diesel tune-up service (drive-in).",811110,81: Other services (except public administration),N/A,415290,1965,No,519-748-5877,1-877-748-6453,mikes@dalsturbo.com,www.dalsturbo.com,Daljit,Kalra,President,Marilyn,Goodyear,Branch Manager,1136,,,df7e295c-056a-4162-8aec-6a7646b820d3
542228.391875,4810799.25,928,"Kesselring, M.H. & Son",36,Rose St,,N2H 1L6,None,Outside CIP,Not downtown,Not downtown,1500,5,"Provide landscaping services including dead tree removal, pruning, trimming and grass cutting services.",561730,"56: Administrative and support, waste management and remediation services",Landscaping services,,1975,No,519-576-8531,,,,Loah,Kesselring,President,Shawn,Kesselring,Vice President,898,,,c1d8eb5d-6fc7-4128-a99c-247f8aa32f41
540846.38475,4811042.35625,929,Public Outreach Consulting Inc.,22,Water St S,11,N2G 4K4,Downtown BIA,In CIP,Downtown,Centre,,8,SERVICES Organizations,TBD,To be determined,To be determined,,,,519-745-0501,,kitchener@publicoutreach.ca,www.publicoutreach.ca,Bethany,Borody,Manager,,,,1344,,,b149a082-b90b-49de-b354-524ef9b69033
544317.60825,4806690.962375,930,Rubberline Products Ltd.,81,Bleams Rd,,N2G 3Y9,None,Outside CIP,Not downtown,Not downtown,43000,25,"Manufacture hydraulic and high pressure hose assemblies, rubber stripping, plastic belts, pneumatics, fluid power, cylinders and valves.",326220,31-33: Manufacturing,Rubber and plastic hose and belting manufacturing,,1961,No,519-894-0400,,,www.rubberline.com,Dennis,Stoyko,President,,,,1451,,,3e4dfb42-deb0-43e2-bacf-350ba012a737
545391.869125,4808931.6495,931,Water Depot,1425,Weber St E,,N2A 3A7,None,Outside CIP,Not downtown,Not downtown,3000,4,"Sell water treatment, equipment and supplies, water coolers, hot tubs, infrared saunas, and iron/sulphur filters.",417910,41: Wholesale trade,Office and store machinery and equipment merchant wholesalers,417920,2006,No,519-748-0533,,waterdepotkw@rogers.com,www.waterdepot.com ,Kate,Moat,Owner,,,,1808,,,f0ee0801-34c1-4e71-b937-9a47da7f3e62
541375.45,4810899.82,932,Amaya Express,20,King St E,,N2G 2K6,Downtown BIA,In CIP,Downtown,Centre,,5,Indian Restaurant,,,,,2016,No,416-473-2051,,amaya.kitchener@gmailcom,,Venkata,pirati,Owner/Operator,,,,1982,,,065c0fcc-1f07-40b8-83fb-0bc683e7fd73
541618.887,4810792.6245,933,15 Scott Hairstyling,15,Scott St,,N2H 2P6,Downtown BIA,In CIP,Downtown,Market,1000,1,,812116,81: Other services (except public administration),Unisex hair salons,,,,519-570-1715,,,,Kelly  ,Kernaghan,Owner,,,,2,,,f74d42d5-c997-4c91-a236-9615d9c54b4b
541618.887,4810792.6245,934,Birthright,15,Scott St,,N2H 2P6,Downtown BIA,In CIP,Downtown,Market,1000,1,SERVICES Organizations,TBD,To be determined,To be determined,,,,519-579-3990,,,www.birthright.org,Sofia,Panchaud,Director,,,,190,,,6f8d7b57-deeb-4fac-a79c-9b82c032d890
541618.887,4810792.6245,935,Fusion Bar and Grill,15,Scott St,,N2H 2P6,Downtown BIA,In CIP,Downtown,Market,,3,DINING Casual Dining,722,72: Accommodation and food services,Food services and drinking places,,,,519-742-4073,,,,,,,,,,659,,,894d0706-a9b6-415b-9aca-0ec96712286f
541618.887,4810792.6245,936,Scone Ladies,15,Scott St,,,Downtown BIA,In CIP,Downtown,Market,,3,"Baking Goods - speciality coffee, teas",,,,,,,519-954-1741,,,www.thesconeladies.ca,,,,,,,1950,The,,4cf000f2-98c6-47f4-abf2-87dfc03b26e1
541618.887,4810792.6245,937,Stonegate Bistro,15,Scott St,3,,Downtown BIA,In CIP,Downtown,Market,,5,DINING Casual Dining,722,72: Accommodation and food services,Food services and drinking places,,,,,,,,,,,,,,1598,,,d29d6d26-ad15-4083-8eab-e4fb14142b57
541618.887,4810792.6245,938,wedding ring.ca,15,Scott St,,N2H 2P6,Downtown BIA,In CIP,Downtown,Market,,2,SERVICES Business Products & Services,TBD,To be determined,To be determined,,,,519-568-8007,,,www.theweddingring.ca,Jennifer ,Goulden,Owner,Ann ,Warren,Owner,1828,The,,59c9c41c-fcfa-4e42-9374-61f5c7a82088
541683.028,4810545.814,939,Paul's,91,Charles St E,,N2G 2P3,Downtown BIA,Outside CIP,Not downtown,Not downtown,180,1,,812110,81: Other services (except public administration),N/A,,,,519-722-7285,,,,Paul,Pfeiffer,Owner,,,,1269,,,b39afbee-b3fd-42e1-a91c-8943fb8844ba
546268.948,4813843.553,940,Interstate Battery,218,Centennial Crt,,N2B 3X2,None,Outside CIP,Not downtown,Not downtown,10000,12,"Distribute wholesale batteries for automobiles, trucks, and computers.",415290,41: Wholesale trade,Other new motor vehicle parts and accessories merchant wholesalers,417320,1990,Yes,519-742-7010,1-800-387-8714,interstatebattery@bellnet.ca,www.interstatebattery.com,Guy,Giroux,Manager,,,,831,,,fcfe7273-e2ac-4cc9-97e5-e2a99012cada
541543.038125,4809887.436375,941,Woodhouse Contracting Ltd.,207,Madison Ave S,,N2G 3M7,None,Outside CIP,Not downtown,Not downtown,10000,55,"Provide 24Hr emergency service whether fire, wind or water damage. Insurance restoration, project management and environmental services, certified to complete mould and asbestos abatement and removal, oil spill cleanups, and trauma scene decontamination.",236110,23: Construction,Residential building construction,562910,1968,No,519-743-7767,1-800-693-7767,info@woodhousecontracting.com,www.woodhousecontracting.com,Bill,Bradley,Customer/Corporate Relations Manager,,,,1864,,,53c461fe-81c3-4499-a458-8d3ce525a667
544459.147,4806385.817,942,CAMplete Solutions Inc.,120,Otonabee Dr,,N2C 1L6,None,Outside CIP,Not downtown,Not downtown,,50,Provide post-processing and machine simulation solutions to help users get the most out of their 5-Axis milling machines,,,,,,,519-725-2557,,query@camplete.com,www.camplete.com,,,,,,,1915,,,0e8d3da4-9d3a-451d-b9b5-4fd310368d23
545359.915875,4804249.287125,943,Tri City Process Servers,35,Anvil St,,N2P 1X6,None,Outside CIP,Not downtown,Not downtown,,3,Serve legal documents in and around the tri city area. Offer the filing and issuing of court documents. Serve all originating documents for law firms and individuals.,541190,"54: Professional, scientific and technical services",Other legal services,,2002,No,519-496-8277,,support@tricityservers.net,www.tricityservers.net,Robert,Kaus,Operation Manager,,,,1708,,,68e868cb-181e-40ff-bb93-6e59012a0491
546748.930125,4810331.01175,944,Muk's Export Inc.,62,Daimler Dr,,N2A 3W3,None,Outside CIP,Not downtown,Not downtown,1680,2,Distribute restaurant equipment.,418920,41: Wholesale trade,"Mineral, ore and precious metal merchant wholesalers",,1990,Yes,519-893-3481,1-800-455-9307,sales@potisna.com,www.rotisserie.info or www.gyrosgrill.com,Hannelore,Maiterth,President,,,,1177,,,e3df8514-42c6-4606-86bd-1f6a79532a47
541797.89,4813428.01,945,Spiro Gear,465,Maple Ave,13,N2H 4X2,None,Outside CIP,Not downtown,Not downtown,5000,4,Manufacture bevel gears.,335315,31-33: Manufacturing,"Switchgear and switchboard, and relay and industrial control apparatus manufacturing",,1986,Yes,519-749-0601,,,,Daniel,Sevcik,President,,,,1562,,,656edb44-8ab8-473a-a388-6e09a66a60b2
543505.489875,4805300.3255,946,United Parcel Service,65,Trillium Park Pl,,N2E 1X1,Huron Business Park,Outside CIP,Not downtown,Not downtown,1000,100,Provide delivery and tracking courier services.,492110,48-49: Transportation and warehousing,Couriers,,1980,No,800-742-5877,1-800-742-5877,,www.ups.com,Timothy M.,Robinson,Operations Manager,Mark,Cooper,Business Manager,1758,,,814e281a-de52-4ef0-b243-bc16a7ceb04b
537516.789375,4808261.377125,947,Putter'n with Pine,7,Montana Cres,,N2N 2R1,None,Outside CIP,Not downtown,Not downtown,500,2,Manufacture country style wood crafts in unfinished states.,321919,31-33: Manufacturing,Other millwork,,1994,No,519-743-2504,,marvin.bower@sympatico.ca,,Marvin,Bower,Owner,Lynda,Bower,Owner,1348,,,d70a453e-8891-47c5-9a5f-1b7c4e36d7c2
541766.074,4810790.331,948,Dietrich Law Office,141,Duke St E,,N2H 1A6,Downtown BIA,In CIP,Downtown,Market,,14,Legal Services,541110,"54: Professional, scientific and technical services",Offices of lawyers,,,,519-749-0770,,george.dietrich@sympatico.ca,www.dietrichlaw.ca,George,Dietrich,Barrister & Solicitor,,,,479,,,d417ec0a-1cbd-4967-a4e3-0dbb51037709
543918.219875,4811935.219875,949,Dhan Systems Management,280,River Rd E,,N2B 2G8,None,Outside CIP,Not downtown,Not downtown,,4,Provide accounting software development and computer system administration.,541514,"54: Professional, scientific and technical services",Computer systems design and related services (except video game design and development),,,No,519-584-0238,,padmini@dhansystems.com,www.dhansystems.com,Padmini,Passaperuma,Owner,Dhan,Passaperuma,System Administrator,475,,,1b848bbc-5e2d-4e5f-b43e-32dc14d25d13
541793.852,4810847.815,950,Kitchener-Waterloo Racquet Club,138,Duke St E,,N2H 1A7,Downtown BIA,In CIP,Downtown,Market,4000,1,SERVICES Health & Wellness,713940,"71: Arts, entertainment and recreation",Fitness and recreational sports centres,,,,519-745-6108,,kwracquet@gmail.com,www.kwracquetclub.com,Chris,Dinsdale,Club Manager,,,,940,,,dae4ee2f-8e51-493f-8e1f-59a4dbd6f095
544497.450875,4806997.642,951,StonePlace Corporation,39,Manitou Dr,,N2C 1K9,None,Outside CIP,Not downtown,Not downtown,600,10,Distribute concrete landscape supplies such as architectural paving tiles and tumbled retaining walls.,416390,41: Wholesale trade,Other specialty-line building supplies merchant wholesalers,561730,2001,No,519-894-1880,,kitchener@stoneplace.com,www.stoneplace.com,Angie,VanBoekel,President & General Manager,Sam,Bell,Kitchener Manager,1599,The,,fc88af63-e508-40fe-b80d-ebae3cfd0cfa
543364.29525,4805844.683625,952,Celadon Canada,280,Shoemaker St,,N2E 3E1,Huron Business Park,Outside CIP,Not downtown,Not downtown,7000,420,Provide truckload carrier services.,484121,48-49: Transportation and warehousing,"General freight trucking, long distance, truck-load",,1972,Yes,519-748-9773,1-800-265-6467,,www.celadoncanada.com,Anni,Hirsimaki,Controller,Harold,Heffernan,General Manager,300,,,f10b2463-38e3-4a0d-9299-0dce504470f7
